{
  "protocolVersion": 1,
  "runKind": "work-accounting-evaluation",
  "outputProfile": "math-flow/work-accounting-transition-v1",
  "problemId": "bssc-sum-capacity",
  "subjectTransactionId": "f236017c62c67ce4218c1f81ea34134f0954b556",
  "rootContractDigest": "sha256:01d52a695e88694768973f3590c0c13eb5acd8070fbed32de8ad01e460c41135",
  "baseAccountingStateDigest": "sha256:766aab95ae1d88a757afce0077e89038041fe98945db5785ea8b71d598333dd6",
  "baseKnowledgeStateDigest": "sha256:64471ccdbed45510517f681d18b1a96102116fcd246b477b0e1a742b2e2c4be5",
  "targetKnowledgeStateDigest": "sha256:0bbdeb3a10f50d634cff67c0606754eee1535272d269d01600a6e36007def3ff",
  "topologyAlignmentDigest": "sha256:b895bca3caeec45f724932b4a38ee02847015ef8e51c9fb535287c849bd5c6dd",
  "submissionEvidenceManifestDigest": "sha256:a69dd143a2ee1a361b1bd65561e79ac9402b0fd71033213b1df43652f6d7150b",
  "submissionDigest": "sha256:4bf6ebede3bdb345c7c3b90bce0e41a35bf3ce8873ec588323097e868d814ef3",
  "acceptedClaimRefsDigest": "sha256:6f6b3e6b8354d45271079f5a9608dde79ed97ec7b9485d38531c86a36a7df0b3",
  "safeFactsDigest": "sha256:4b79291b7771d20a8253bf3eaa4eca0f209c02a062622606ddb2af75ddd483da",
  "impactContextDigest": "sha256:96397d24a00a8b7fb9865a5b44cef4d4e78dd81b44ff7444b93be7cba4237081",
  "requestDigests": [
    "sha256:dad48c1a9732a2bb05a7b97907c64294956d733888240ee47f95523ecfe7d256",
    "sha256:08f6136f6893cd5d313cef3091e6235b4c23e6245187afdd7d838541f9be8de4",
    "sha256:5e9b47754dac357b0a67f7c5ecf458cf5dddc4b28f9acbd6b33aa253eb08b559"
  ],
  "responseDigests": [
    {
      "stage": "safe-facts",
      "digest": "sha256:776eeaa80a92a14f7bf9b8c137b350d9ecfb45e832f43731b7bad5286795cbfd"
    },
    {
      "stage": "no-access",
      "digest": "sha256:a80d994308f16cd8ab84e148461400b7a15f5e117a5a01c401c3a3ed49419cf4"
    },
    {
      "stage": "with-access",
      "digest": "sha256:a9fc0650feaef316e8775535fa3a0380d07e9799de13d798f3fae18c5ab31a24"
    }
  ],
  "noAccessPatchDigest": "sha256:8563a396937a9eb0bdd59da9fac64e2cfeb28db0afc434b44641c1513aa59ad2",
  "withAccessPatchDigest": "sha256:06c8b17b8bb1f98101dd534e6345a3f4174e23df5bfe518efa96433b1fc795f9",
  "noAccessStateDigest": "sha256:546784377e06ae39c212bb0b82a86ff69bea4594d9bcddc875ca82e271a01c9f",
  "withAccessStateDigest": "sha256:5fe23d4603ddbd70bda515c8f87567ae2edcb332789958ff218fc629b083dead",
  "evaluationDigest": "sha256:c0de76a31f3ecefbccc8957681fca353c80c40b1bb1f195d6eafeb72fd0032d6",
  "artifacts": [
    {
      "path": "context/impact-subgraph.json",
      "role": "work-impact-context",
      "mediaType": "application/json",
      "digest": "sha256:25ead8be1d6893fa4485f926e4839009c3091bb2c46dcbb0a102dca570c0ba62",
      "bytes": 11445
    },
    {
      "path": "context/safe-facts.json",
      "role": "counterfactual-safe-facts",
      "mediaType": "application/json",
      "digest": "sha256:33156e61da4eca9dba445fa86cd3fdd6fe3b7104b4f540788300f310d9a0920a",
      "bytes": 1964
    },
    {
      "path": "evaluation.json",
      "role": "submission-work-evaluation",
      "mediaType": "application/json",
      "digest": "sha256:34045c1c0cae12bd7b49a531b2b028a7126e65c40e48a48190a6022469d89bd4",
      "bytes": 1624
    },
    {
      "path": "input/base-accounting-state.json",
      "role": "work-base-accounting-state",
      "mediaType": "application/json",
      "digest": "sha256:d104082561a68b9767ec20ed5523a1e160ed1e5a2cd2891cf39a2d4231d070fc",
      "bytes": 3877
    },
    {
      "path": "input/base-knowledge-state.json",
      "role": "work-base-knowledge-state",
      "mediaType": "application/json",
      "digest": "sha256:abbef890b4b5fffda8709355f00c9c8f1e036c1cf812bd52f795ce682ebc5373",
      "bytes": 10377
    },
    {
      "path": "input/evidence/chunks/64ddb2c3d0c375bbca746842e21689f11883d989d56a0f0028ceaf216715e623.bin",
      "role": "submission-evidence-chunk",
      "mediaType": "application/octet-stream",
      "digest": "sha256:64ddb2c3d0c375bbca746842e21689f11883d989d56a0f0028ceaf216715e623",
      "bytes": 8398
    },
    {
      "path": "input/evidence/chunks/69a33f9fc84a5dbabbad6bdf53b34e722238c6a6b3f625d49e00f599e942b94a.bin",
      "role": "submission-evidence-chunk",
      "mediaType": "application/octet-stream",
      "digest": "sha256:69a33f9fc84a5dbabbad6bdf53b34e722238c6a6b3f625d49e00f599e942b94a",
      "bytes": 14681
    },
    {
      "path": "input/evidence/chunks/bdd966d11f1914425ed4932b459c83508a6a61a73131f4f2a184204ad0c4153e.bin",
      "role": "submission-evidence-chunk",
      "mediaType": "application/octet-stream",
      "digest": "sha256:bdd966d11f1914425ed4932b459c83508a6a61a73131f4f2a184204ad0c4153e",
      "bytes": 8067
    },
    {
      "path": "input/evidence/chunks/fe480b29698c63afd6c80d4e3c5b155d227ce19b74910de8a38f73b807a94e9a.bin",
      "role": "submission-evidence-chunk",
      "mediaType": "application/octet-stream",
      "digest": "sha256:fe480b29698c63afd6c80d4e3c5b155d227ce19b74910de8a38f73b807a94e9a",
      "bytes": 8568
    },
    {
      "path": "input/evidence/chunks/ffa2b5d66670f0fd03338e73f8ecc5400bf23b162a92fa327f363c7bb1aac6c0.bin",
      "role": "submission-evidence-chunk",
      "mediaType": "application/octet-stream",
      "digest": "sha256:ffa2b5d66670f0fd03338e73f8ecc5400bf23b162a92fa327f363c7bb1aac6c0",
      "bytes": 5740
    },
    {
      "path": "input/evidence/manifest.json",
      "role": "submission-evidence-manifest",
      "mediaType": "application/json",
      "digest": "sha256:1ddc16fd26265d17b283b7f23eea6143156435e0efdfca6e38e0bd3ed1aee4a6",
      "bytes": 2889
    },
    {
      "path": "input/root-contract.json",
      "role": "work-root-contract",
      "mediaType": "application/json",
      "digest": "sha256:66853b6b7992d661340dd8b4c6f1b30978eb187a06d1cd275ee8b27bb15cef85",
      "bytes": 1988
    },
    {
      "path": "input/target-knowledge-state.json",
      "role": "work-target-knowledge-state",
      "mediaType": "application/json",
      "digest": "sha256:35da5bae43937df4f0ff291ed40f5ec8db5fb20e92d1f566b3fe0fdb047c2c7e",
      "bytes": 21464
    },
    {
      "path": "input/topology-alignment.json",
      "role": "work-topology-alignment",
      "mediaType": "application/json",
      "digest": "sha256:693b4e03c28c10864330653ba116047afbd2a255fd72a0eae9b09020e6801475",
      "bytes": 6071
    },
    {
      "path": "stages/no-access/input.json",
      "role": "no-access-stage-input",
      "mediaType": "application/json",
      "digest": "sha256:e7c1949ebdb63be7d4c5d9242a762d7b30a42ee657d520333c3e9f7ed2d0556c",
      "bytes": 15197
    },
    {
      "path": "stages/no-access/request.json",
      "role": "no-access-request",
      "mediaType": "application/json",
      "digest": "sha256:ee66a829d1291f7f4b87a304837c6cd41b88536c2b8197efc304b9f42a40b95a",
      "bytes": 24863
    },
    {
      "path": "stages/no-access/response.json",
      "role": "no-access-response",
      "mediaType": "application/json",
      "digest": "sha256:828bed1724bbb2706f2a8121ee13f950b773c466e8c01542bed4c9c8f9c3d416",
      "bytes": 2774
    },
    {
      "path": "stages/safe-facts/request.json",
      "role": "safe-facts-request",
      "mediaType": "application/json",
      "digest": "sha256:4c7495aea0901f1f112bd05a16b5b6ae87742a8c0e5100f70d9da54b48eb728c",
      "bytes": 11918
    },
    {
      "path": "stages/safe-facts/response.json",
      "role": "safe-facts-response",
      "mediaType": "application/json",
      "digest": "sha256:27ea4280c28d09c50730cb760a6e1cdd041de52e3d94444c5cad81e83322ab1d",
      "bytes": 1153
    },
    {
      "path": "stages/with-access/input.json",
      "role": "with-access-stage-input",
      "mediaType": "application/json",
      "digest": "sha256:93fe3b18132582d71581da4e582fed80c6fa81e339e5970101db35976c600af8",
      "bytes": 16817
    },
    {
      "path": "stages/with-access/request.json",
      "role": "with-access-request",
      "mediaType": "application/json",
      "digest": "sha256:59b8b10e056297dabb99fe14366d4eaa1e7a72d36a13071e24a0e80dd234339b",
      "bytes": 26573
    },
    {
      "path": "stages/with-access/response.json",
      "role": "with-access-response",
      "mediaType": "application/json",
      "digest": "sha256:9b9711d54eef6223865fa5d74351e649c0b535574a59f06c32b430f94a04d658",
      "bytes": 2876
    },
    {
      "path": "state/no-access-patch.json",
      "role": "no-access-work-patch",
      "mediaType": "application/json",
      "digest": "sha256:fbbd52560092e63b28c5be4c43e8377b400daa225e60e4090b8fae1bae939abf",
      "bytes": 3692
    },
    {
      "path": "state/no-access-state.json",
      "role": "no-access-work-state",
      "mediaType": "application/json",
      "digest": "sha256:52b88c2d1cdd6dc36bf9b715e5968a53568dcd3abbd75d76fdc52218d0063e1a",
      "bytes": 6312
    },
    {
      "path": "state/with-access-patch.json",
      "role": "with-access-work-patch",
      "mediaType": "application/json",
      "digest": "sha256:d2380ffa404687d14e45e7b44e7f284ab65448b3ad23dc1f662ec16d33278b46",
      "bytes": 3796
    },
    {
      "path": "state/with-access-state.json",
      "role": "with-access-work-state",
      "mediaType": "application/json",
      "digest": "sha256:8a847fc836b714b30e515c4d8bda705e56d8b35c8b4ab2578dbf79fc0b5ad41a",
      "bytes": 6355
    }
  ]
}
