{
  "protocolVersion": 1,
  "runKind": "work-accounting-evaluation",
  "outputProfile": "math-flow/work-accounting-transition-v1",
  "problemId": "bssc-sum-capacity",
  "subjectTransactionId": "14889884ae6ac1f80cc56485e7acf1b0b2cb6ae9",
  "rootContractDigest": "sha256:01d52a695e88694768973f3590c0c13eb5acd8070fbed32de8ad01e460c41135",
  "baseAccountingStateDigest": "sha256:5fe23d4603ddbd70bda515c8f87567ae2edcb332789958ff218fc629b083dead",
  "baseKnowledgeStateDigest": "sha256:0bbdeb3a10f50d634cff67c0606754eee1535272d269d01600a6e36007def3ff",
  "targetKnowledgeStateDigest": "sha256:04d09ef748906bd0af20dfa0fa1f2749a940b911cdd2706a2cbcbb10bbe5a684",
  "topologyAlignmentDigest": "sha256:338c3d2183c3997c38e732578552b0a4e01206c7b08dd536d74820a9c24b8f7b",
  "submissionEvidenceManifestDigest": "sha256:9479bc70dd16c058ed04a39990bbcd415e0d3da9eec64c3e1ee5d26edf59455f",
  "submissionDigest": "sha256:e45d569c12739034d9d7e1049a033268924cebb20b7359b079960e93e480ca91",
  "acceptedClaimRefsDigest": "sha256:0fe7e22442f339e8ddfd3dfdfa93b416e0518e0327dd99b133e23c943c08484e",
  "safeFactsDigest": "sha256:a8229ef945f58010f381c6119c0f2229906c124153b49a2da22fcf9b69c1bd55",
  "impactContextDigest": "sha256:50308fc1872c98849a2520527d0f125ca082c36ba84a154c1f555c87e4674acf",
  "requestDigests": [
    "sha256:e94940d69a9c10866f91c029c220a6bb2c270f9cf265af2b4110c663e5622ad7",
    "sha256:36689dc0fc84c3d59a37354ec63c27702e2b37663b76dee9cb9599916fedd6c2",
    "sha256:2343cf0c0da1f3aa15221704d761f458c0eb08cf3b7e78c83161cf708027bb10"
  ],
  "responseDigests": [
    {
      "stage": "safe-facts",
      "digest": "sha256:1525f9f62a52f59e8c4afb1b1aea0f47ae871dd3ccb13afae40589b1ca5f5aae"
    },
    {
      "stage": "no-access",
      "digest": "sha256:490dea482df23bbc173db1f9afd748e14de26cd6f12e4eccd34f6a7f6acdd5bf"
    },
    {
      "stage": "with-access",
      "digest": "sha256:a5357a8f4d022c323ffc2305d4f26afddf594635533ee9e3a7fcee7c45527de9"
    }
  ],
  "noAccessPatchDigest": "sha256:fe3b43c4e57b04ea380f68a182917b7f5fd314076c1f28fc38dbc206b2962284",
  "withAccessPatchDigest": "sha256:b2226cd67be77118713b18e48a1038a9fa0a20880a291dba7c4149906be1c360",
  "noAccessStateDigest": "sha256:b589a497d5a2402ce15a9618bc4e1775b95c42d79e29cbc7cbeda675f80b40ff",
  "withAccessStateDigest": "sha256:14d57e5d25ffce02309281e49955172e6ca136c529d58e4d2fd9344cdd45408c",
  "evaluationDigest": "sha256:1e2d664323e4d513cb82d704ee63f8341585134d54ab60d1a3973edec0b0fe28",
  "artifacts": [
    {
      "path": "context/impact-subgraph.json",
      "role": "work-impact-context",
      "mediaType": "application/json",
      "digest": "sha256:bd3b983b4ead53c38310d7de95da7d48ffae59fc5eab0c823962b0c277c637a3",
      "bytes": 13425
    },
    {
      "path": "context/safe-facts.json",
      "role": "counterfactual-safe-facts",
      "mediaType": "application/json",
      "digest": "sha256:eb0655595bc650627486da4acbb004f33ebcfd41be9bf815c6b912b253bc74e7",
      "bytes": 2937
    },
    {
      "path": "evaluation.json",
      "role": "submission-work-evaluation",
      "mediaType": "application/json",
      "digest": "sha256:3717869dc1f1e3a130925cd0dd2286dede1b806c7d4316a8bf2f5ba8d2d2f6d4",
      "bytes": 1548
    },
    {
      "path": "input/base-accounting-state.json",
      "role": "work-base-accounting-state",
      "mediaType": "application/json",
      "digest": "sha256:6ac6216c1e839b3ee0b8a0cfbd0c30f67e6f703861bdcb7d5aca56de2be1fd43",
      "bytes": 6355
    },
    {
      "path": "input/base-knowledge-state.json",
      "role": "work-base-knowledge-state",
      "mediaType": "application/json",
      "digest": "sha256:35da5bae43937df4f0ff291ed40f5ec8db5fb20e92d1f566b3fe0fdb047c2c7e",
      "bytes": 21464
    },
    {
      "path": "input/evidence/chunks/0d46c2dbd1a62f0385fc4d8878d8cfef3749f85cca019e1284c5e54c12016874.bin",
      "role": "submission-evidence-chunk",
      "mediaType": "application/octet-stream",
      "digest": "sha256:0d46c2dbd1a62f0385fc4d8878d8cfef3749f85cca019e1284c5e54c12016874",
      "bytes": 938
    },
    {
      "path": "input/evidence/chunks/96375d4961d1ed5f5f5b3da368e59c60c4bd0fc6779b741a484b40f2114db4a2.bin",
      "role": "submission-evidence-chunk",
      "mediaType": "application/octet-stream",
      "digest": "sha256:96375d4961d1ed5f5f5b3da368e59c60c4bd0fc6779b741a484b40f2114db4a2",
      "bytes": 1427
    },
    {
      "path": "input/evidence/chunks/c4df63434cb0c5f76918bd0ba578629f7373d4f2b24d6d6b5e21d3c253f2e852.bin",
      "role": "submission-evidence-chunk",
      "mediaType": "application/octet-stream",
      "digest": "sha256:c4df63434cb0c5f76918bd0ba578629f7373d4f2b24d6d6b5e21d3c253f2e852",
      "bytes": 7416
    },
    {
      "path": "input/evidence/chunks/d0dce591c90e6b529890b34e4bd515167ea3c447daef11e95f28e1c5f3c328d2.bin",
      "role": "submission-evidence-chunk",
      "mediaType": "application/octet-stream",
      "digest": "sha256:d0dce591c90e6b529890b34e4bd515167ea3c447daef11e95f28e1c5f3c328d2",
      "bytes": 236
    },
    {
      "path": "input/evidence/manifest.json",
      "role": "submission-evidence-manifest",
      "mediaType": "application/json",
      "digest": "sha256:9da5e16c3a8e1fa306079444321ec826e2a8b6ccd35c3ee34d63b6f982ea02bf",
      "bytes": 2331
    },
    {
      "path": "input/root-contract.json",
      "role": "work-root-contract",
      "mediaType": "application/json",
      "digest": "sha256:66853b6b7992d661340dd8b4c6f1b30978eb187a06d1cd275ee8b27bb15cef85",
      "bytes": 1988
    },
    {
      "path": "input/target-knowledge-state.json",
      "role": "work-target-knowledge-state",
      "mediaType": "application/json",
      "digest": "sha256:b0c7845b6cff98706c6f0f7d72b590367243838df270f05750d318b3a45e41ba",
      "bytes": 26746
    },
    {
      "path": "input/topology-alignment.json",
      "role": "work-topology-alignment",
      "mediaType": "application/json",
      "digest": "sha256:52b93e66716db7b3ac520b9fb2b9ff47d59a741beb665240c2eb5ed24aad1195",
      "bytes": 8008
    },
    {
      "path": "stages/no-access/input.json",
      "role": "no-access-stage-input",
      "mediaType": "application/json",
      "digest": "sha256:29ca148522b826f53b64ef14f2a9fee78942226dfdb6968177412e6abb373f15",
      "bytes": 18309
    },
    {
      "path": "stages/no-access/request.json",
      "role": "no-access-request",
      "mediaType": "application/json",
      "digest": "sha256:65b653db1a1550904fc85da880d25a01fd6cc8f2fec1c0f8f06894379fdffbc9",
      "bytes": 29725
    },
    {
      "path": "stages/no-access/response.json",
      "role": "no-access-response",
      "mediaType": "application/json",
      "digest": "sha256:a109ff7e18b03e7bfc14dffac557fe35ca38a02e08e7605027c0db5955f102ff",
      "bytes": 1390
    },
    {
      "path": "stages/safe-facts/request.json",
      "role": "safe-facts-request",
      "mediaType": "application/json",
      "digest": "sha256:5661ef1e903ca9e96162103fa9d91e35c1f177b66123d6e42cc5d85e1dd06d68",
      "bytes": 13860
    },
    {
      "path": "stages/safe-facts/response.json",
      "role": "safe-facts-response",
      "mediaType": "application/json",
      "digest": "sha256:61564a9ea2cf47ba917bc20755eb50f91cf1894c6ced3c5984dca693c8363d14",
      "bytes": 2125
    },
    {
      "path": "stages/with-access/input.json",
      "role": "with-access-stage-input",
      "mediaType": "application/json",
      "digest": "sha256:d835a061c26818df073cc2f3afe8c24ff5f7c7314dcce3e24073b9f54b5b0ee9",
      "bytes": 18255
    },
    {
      "path": "stages/with-access/request.json",
      "role": "with-access-request",
      "mediaType": "application/json",
      "digest": "sha256:5a567247d2e5b5f3d78be36f75d83bb3cc118fa0cbe3fd47104652ce087cda19",
      "bytes": 29695
    },
    {
      "path": "stages/with-access/response.json",
      "role": "with-access-response",
      "mediaType": "application/json",
      "digest": "sha256:aafa8d3849ff5ad76f738ae09c9094344c3be507d921e14749915995fdad2c89",
      "bytes": 896
    },
    {
      "path": "state/no-access-patch.json",
      "role": "no-access-work-patch",
      "mediaType": "application/json",
      "digest": "sha256:8fabeba99da5819408ae58f6cee88e7915c5a1c1b67f055dbc6d2063354ceaf1",
      "bytes": 2374
    },
    {
      "path": "state/no-access-state.json",
      "role": "no-access-work-state",
      "mediaType": "application/json",
      "digest": "sha256:e406b4f79bb0ea70453509468e579a8c000ba83bb1cd9f070025c885fe123278",
      "bytes": 6360
    },
    {
      "path": "state/with-access-patch.json",
      "role": "with-access-work-patch",
      "mediaType": "application/json",
      "digest": "sha256:2967f5245f16e47f6a4740055bf94e75846399c9a710d7df938de2ec5983c1b1",
      "bytes": 1777
    },
    {
      "path": "state/with-access-state.json",
      "role": "with-access-work-state",
      "mediaType": "application/json",
      "digest": "sha256:1ac3d81fa0fc5ea316835d993909367e629a4af58fb2b95f9780b2570066d237",
      "bytes": 6403
    }
  ]
}
