{
  "protocolVersion": 1,
  "runKind": "work-accounting-evaluation",
  "outputProfile": "math-flow/work-accounting-transition-v1",
  "problemId": "bssc-sum-capacity",
  "subjectTransactionId": "906894532b971ecf8c4ac6fcdd3f7380e00549b2",
  "rootContractDigest": "sha256:01d52a695e88694768973f3590c0c13eb5acd8070fbed32de8ad01e460c41135",
  "baseAccountingStateDigest": "sha256:a565cd4bf63e43981071e58e16ba3cfb3631b910ef0672f2e123c43e55a94dd1",
  "baseKnowledgeStateDigest": "sha256:6790bf618ff33d6171ec1d7d54fb0e9f1827ed28d743935afba31a8c591c4d00",
  "targetKnowledgeStateDigest": "sha256:a538e38923ffc39056053598a8c950230ae1a9b8c099b638402eb254e5c340c0",
  "topologyAlignmentDigest": "sha256:6253af560980f28acf54e8a5ffb83e1dcc75dd3eb3028f312e5d7025885edf15",
  "submissionEvidenceManifestDigest": "sha256:bdf86101ac115102a1f7e4baa33fc3932b22f93bd5462427c089b9c7bca2fc63",
  "submissionDigest": "sha256:c7858e2b6bff0ceaa7bbdfbe8116ce38142497169a5595cb038c043e4db64e57",
  "acceptedClaimRefsDigest": "sha256:443142aba0d1f06ba53a6595cec4119194349309036a90cd470d3962e364c7b0",
  "safeFactsDigest": "sha256:ffebb9267a1a70094dce37db20b56ba0e69c2a9229251dfe38e2cf77edc4b873",
  "impactContextDigest": "sha256:0989c14325340e2d5b7e547b5961bd5fe1b677eb521ffcf3b5428bbc0773e7ae",
  "requestDigests": [
    "sha256:df7368989e70d29c319591447667dcf05c8f76713d1279f0535eb159574a2140",
    "sha256:b413c5caa2b7aa9f2e33aa3b6ce33c928de3c1a115ee4964a1cb78a0cf0e3a86",
    "sha256:25044d20c37dbb684f4fdb304c4a5d03b0645fcb433f6b04eb72eaeaabea253b"
  ],
  "responseDigests": [
    {
      "stage": "safe-facts",
      "digest": "sha256:f6eb7a2117a9b5e47d0e8be0c573bbecf83d2e014146f42ed76e65f01a0d9950"
    },
    {
      "stage": "no-access",
      "digest": "sha256:6db7d462240e157968aa73c187884c92e94863580c729069c8a26db4c807b6e3"
    },
    {
      "stage": "with-access",
      "digest": "sha256:900350670d726171411401cc7109e4d3f31189b430800c4786b1af5a179a6795"
    }
  ],
  "noAccessPatchDigest": "sha256:e81451feea7deeb97393a281a84c7a0d62beda5367bcf92dc3f625461619f712",
  "withAccessPatchDigest": "sha256:157bad3361e4b1ff5841c0715e832edfcbd7cc00c4347d7f830e7a406c3a0ef4",
  "noAccessStateDigest": "sha256:4aec126a82fd99aeac2103e643f2d0565cf2269c87b40610b715afdd77886ef3",
  "withAccessStateDigest": "sha256:f476678c999be68bd977618508b04bcc94352ae0889b5fb08693d538c761ee0b",
  "evaluationDigest": "sha256:65f2fb36c33e6edd94d0c40c262a1ab298778d6dfc4424bd7eb96ab7a0de3f6d",
  "artifacts": [
    {
      "path": "context/impact-subgraph.json",
      "role": "work-impact-context",
      "mediaType": "application/json",
      "digest": "sha256:cffaec81546a98d23dfac6628b0bd0ba379b1f47cbd652cfbe4f4281de86f466",
      "bytes": 45315
    },
    {
      "path": "context/safe-facts.json",
      "role": "counterfactual-safe-facts",
      "mediaType": "application/json",
      "digest": "sha256:b0cff4fa29b749618d7e39e7cbc80c31052fa029291e8f3ce3fbeaa00be43d6d",
      "bytes": 2083
    },
    {
      "path": "evaluation.json",
      "role": "submission-work-evaluation",
      "mediaType": "application/json",
      "digest": "sha256:e546dcf637c90ae0d0e8939869af0e0d4d33fa44b05fd4ab62ac5ebe3619e7c0",
      "bytes": 1517
    },
    {
      "path": "input/base-accounting-state.json",
      "role": "work-base-accounting-state",
      "mediaType": "application/json",
      "digest": "sha256:151953d02db2351d23a36a55e8c32b4d090c9a69182d8de5d6800c0df04c5ef4",
      "bytes": 12709
    },
    {
      "path": "input/base-knowledge-state.json",
      "role": "work-base-knowledge-state",
      "mediaType": "application/json",
      "digest": "sha256:1f82b7f6bd7d59c0fb06649bb4328942433eedd85e0b0480ac65608fafddab83",
      "bytes": 102460
    },
    {
      "path": "input/evidence/chunks/48cafb76a9fb8682784d85548ea8abb532ef28c4f496605a83227887b2b85998.bin",
      "role": "submission-evidence-chunk",
      "mediaType": "application/octet-stream",
      "digest": "sha256:48cafb76a9fb8682784d85548ea8abb532ef28c4f496605a83227887b2b85998",
      "bytes": 981
    },
    {
      "path": "input/evidence/chunks/60838ff19a5328d411bb4aa9f7c8bc78a2445d26bdf41a0740e2d08b2ad4a7bc.bin",
      "role": "submission-evidence-chunk",
      "mediaType": "application/octet-stream",
      "digest": "sha256:60838ff19a5328d411bb4aa9f7c8bc78a2445d26bdf41a0740e2d08b2ad4a7bc",
      "bytes": 7402
    },
    {
      "path": "input/evidence/chunks/9764fcc6d169eaa82f04d483f6dec405c8df5eff3f9c94bcee3dd46a1ee40b69.bin",
      "role": "submission-evidence-chunk",
      "mediaType": "application/octet-stream",
      "digest": "sha256:9764fcc6d169eaa82f04d483f6dec405c8df5eff3f9c94bcee3dd46a1ee40b69",
      "bytes": 221
    },
    {
      "path": "input/evidence/chunks/d76ac238ad4a54b7c6cbe365f63cba591210de2924186bb05d18314c17dbb33c.bin",
      "role": "submission-evidence-chunk",
      "mediaType": "application/octet-stream",
      "digest": "sha256:d76ac238ad4a54b7c6cbe365f63cba591210de2924186bb05d18314c17dbb33c",
      "bytes": 5630
    },
    {
      "path": "input/evidence/manifest.json",
      "role": "submission-evidence-manifest",
      "mediaType": "application/json",
      "digest": "sha256:ba7e162226674e5849ad2a4ada5b2f40db37f610c3bfd78e9e675a0f90057ec6",
      "bytes": 2341
    },
    {
      "path": "input/root-contract.json",
      "role": "work-root-contract",
      "mediaType": "application/json",
      "digest": "sha256:66853b6b7992d661340dd8b4c6f1b30978eb187a06d1cd275ee8b27bb15cef85",
      "bytes": 1988
    },
    {
      "path": "input/target-knowledge-state.json",
      "role": "work-target-knowledge-state",
      "mediaType": "application/json",
      "digest": "sha256:5b5ddbb76ec5bd77ffb8f5c9b9929180edf4382ded873f03e235c1c983678d6e",
      "bytes": 107293
    },
    {
      "path": "input/topology-alignment.json",
      "role": "work-topology-alignment",
      "mediaType": "application/json",
      "digest": "sha256:b9ddea91d8fd29279b8f9403f8124281d54965ba2f2502aab18b60a90d0640cc",
      "bytes": 26811
    },
    {
      "path": "stages/no-access/input.json",
      "role": "no-access-stage-input",
      "mediaType": "application/json",
      "digest": "sha256:8c7b64d736acbc12c508226d09422bc7a56c7b43eefe78fe2c499a7522abcaac",
      "bytes": 50988
    },
    {
      "path": "stages/no-access/request.json",
      "role": "no-access-request",
      "mediaType": "application/json",
      "digest": "sha256:367334b1e803df24e2ca52f287c46e1168e3216a9f2c169861722e7cee0944d2",
      "bytes": 70760
    },
    {
      "path": "stages/no-access/response.json",
      "role": "no-access-response",
      "mediaType": "application/json",
      "digest": "sha256:6e33690ee22765f62bac8703424d699d2d156b50f3237c0bbc21ced69d4776db",
      "bytes": 765
    },
    {
      "path": "stages/safe-facts/request.json",
      "role": "safe-facts-request",
      "mediaType": "application/json",
      "digest": "sha256:c9972c232a766e1a1a90fcf512e9401be3ebed763f5fd96557c208b8d8e7a479",
      "bytes": 20593
    },
    {
      "path": "stages/safe-facts/response.json",
      "role": "safe-facts-response",
      "mediaType": "application/json",
      "digest": "sha256:202e89f8372b865ef5d1a69638b7a7f2888bfb27b9985d63b766486505aa504c",
      "bytes": 1266
    },
    {
      "path": "stages/with-access/input.json",
      "role": "with-access-stage-input",
      "mediaType": "application/json",
      "digest": "sha256:1427c8d229710d7b60f4b1262d678907aa47f4f9a2a79ee8927fe693b5478262",
      "bytes": 51836
    },
    {
      "path": "stages/with-access/request.json",
      "role": "with-access-request",
      "mediaType": "application/json",
      "digest": "sha256:f9fcb153f3f15b0e61b13a57ce094cd3c01a12716c81a345d464e18fd0611a5a",
      "bytes": 71670
    },
    {
      "path": "stages/with-access/response.json",
      "role": "with-access-response",
      "mediaType": "application/json",
      "digest": "sha256:22a3e49d9eee5479a74cbf92f200f9d09898abc044021e704c0a6e3a8c332dfa",
      "bytes": 1035
    },
    {
      "path": "state/no-access-patch.json",
      "role": "no-access-work-patch",
      "mediaType": "application/json",
      "digest": "sha256:c8d2bcd28a1ff13e117a9c95c3d84be28fecace81eb9b1833d945581a5d0846c",
      "bytes": 1644
    },
    {
      "path": "state/no-access-state.json",
      "role": "no-access-work-state",
      "mediaType": "application/json",
      "digest": "sha256:b7f4695783895dea4aa085a5468f40895e89660c05056824a4ea6e994bbe43b1",
      "bytes": 12711
    },
    {
      "path": "state/with-access-patch.json",
      "role": "with-access-work-patch",
      "mediaType": "application/json",
      "digest": "sha256:602026644e7c85bf8c4d510a8352f6990cd29e04e069e38adc63d60d45894afe",
      "bytes": 1916
    },
    {
      "path": "state/with-access-state.json",
      "role": "with-access-work-state",
      "mediaType": "application/json",
      "digest": "sha256:3c9c41a8f6c4024b2f37fdb10dd0ebf094c0d0b028eeaa617b4daab793f9cec8",
      "bytes": 12761
    }
  ]
}
