{
  "protocolVersion": 1,
  "runKind": "work-accounting-evaluation",
  "outputProfile": "math-flow/work-accounting-transition-v1",
  "problemId": "bssc-sum-capacity",
  "subjectTransactionId": "b4f10336d43f1c31a11ecbc5f4eb94f1fca70e05",
  "rootContractDigest": "sha256:01d52a695e88694768973f3590c0c13eb5acd8070fbed32de8ad01e460c41135",
  "baseAccountingStateDigest": "sha256:727c11ef6a094e33900be941b6ba548a5b5940b091edb37a8d18f18fb48e3f8d",
  "baseKnowledgeStateDigest": "sha256:82600b62e8c3e7f14be197a9577d402d73d41d205566ac4a8733b55ebb4e64e6",
  "targetKnowledgeStateDigest": "sha256:38948e69ea259630786b4688beb93d0acaa5581a65fb63cb80210945be08affe",
  "topologyAlignmentDigest": "sha256:6d3304ef3b007547820d266e5910f649dc9833b3f5256ba5a66e0b88686030fc",
  "submissionEvidenceManifestDigest": "sha256:5945c513ce33a743072779c8d2af9e40ec3742c77e817df3da66641f2d9a7af9",
  "submissionDigest": "sha256:f3e09fe3b450832cc67c0ba0645db56cc49e3edc3972d914f821a90d1eba51f4",
  "acceptedClaimRefsDigest": "sha256:9e1ae45831a14a8a695cb0605d0fab568f35b8cf2d43165b09fc02c49aa376c9",
  "safeFactsDigest": "sha256:b006cbf24fcda3b121026a607ea45eec34b20fa235b6166bc1d6041d5bd4921f",
  "impactContextDigest": "sha256:60d1e325a2a083b446d73530644ba8cf7c50da23cf469182e1330a1ef168f491",
  "requestDigests": [
    "sha256:cdcb68658a78d2dc31c012e2d3fa0831e4afe4000c1ee3dd56cfb5d648d671f7",
    "sha256:5e18dc5978e0bcf1a9fe06ab9cd16789c1a89fc8dc218dff2a9d4e36a4399a87",
    "sha256:fabb20b1310b2a7708bb9ea7e7c0a99b589e7de2abd9936d322a079ed564c670"
  ],
  "responseDigests": [
    {
      "stage": "safe-facts",
      "digest": "sha256:0dd87dedd5a54f7aad68955946c467d2e7236f15c2d0166e93d66562da77ef15"
    },
    {
      "stage": "no-access",
      "digest": "sha256:e3549cf125c9124ea9afb0fa5ded5d2e88ccf6e7dd615bb83c395221559f0da9"
    },
    {
      "stage": "with-access",
      "digest": "sha256:7ffc215d0538fd0d61f6827be3153c31c024b7985f2d59153f7b004830fbcaff"
    }
  ],
  "noAccessPatchDigest": "sha256:1d6e5ce326b4e82569f8e71e9a4b1ad5bda3e6b3df3c4b92fdc28fb48318d0c5",
  "withAccessPatchDigest": "sha256:a0edd52d4d21f28f7682e63e7ebd0ebd26ee73c8172157fada1f0ac9ed9f0730",
  "noAccessStateDigest": "sha256:6ec07286f3e098bebdbb0ce4f2c74abb0371f1d0fc3a127c1856cc09ef0c00b7",
  "withAccessStateDigest": "sha256:66b294e828904d0ef392488d3549a4fbd5304b5238a5a9571e8ca7c76f41d684",
  "evaluationDigest": "sha256:41e86d4d7c723aa39524f712ea3be6c1d493678b5cd69a4688972acc76019240",
  "artifacts": [
    {
      "path": "context/impact-subgraph.json",
      "role": "work-impact-context",
      "mediaType": "application/json",
      "digest": "sha256:0fb24156f1128fb1000838c2e43166e1448b94ac222f7fcdf5525b1ad0dc0017",
      "bytes": 31306
    },
    {
      "path": "context/safe-facts.json",
      "role": "counterfactual-safe-facts",
      "mediaType": "application/json",
      "digest": "sha256:627479f821e87b563ffc7f2882bec4a3640a2ed646d64e43b49044ceb9c700ae",
      "bytes": 2052
    },
    {
      "path": "evaluation.json",
      "role": "submission-work-evaluation",
      "mediaType": "application/json",
      "digest": "sha256:6f57bb2ed68d39f77e748e0100d906e42568eefcb25573142630ae8256fa3e23",
      "bytes": 1674
    },
    {
      "path": "input/base-accounting-state.json",
      "role": "work-base-accounting-state",
      "mediaType": "application/json",
      "digest": "sha256:25402faa1473abb29c28716e7f83a292a07d00b77f79c716f22de5be5119ab65",
      "bytes": 9207
    },
    {
      "path": "input/base-knowledge-state.json",
      "role": "work-base-knowledge-state",
      "mediaType": "application/json",
      "digest": "sha256:236fd65dedbc0fa44cd315769404f9c8f89c2327aefb92335ba54ed9d8961a27",
      "bytes": 62011
    },
    {
      "path": "input/evidence/chunks/9764fcc6d169eaa82f04d483f6dec405c8df5eff3f9c94bcee3dd46a1ee40b69.bin",
      "role": "submission-evidence-chunk",
      "mediaType": "application/octet-stream",
      "digest": "sha256:9764fcc6d169eaa82f04d483f6dec405c8df5eff3f9c94bcee3dd46a1ee40b69",
      "bytes": 221
    },
    {
      "path": "input/evidence/chunks/9e1fbc8415ecf99f413316e55c130780277278267ef7710bf2a6fa721ad9678b.bin",
      "role": "submission-evidence-chunk",
      "mediaType": "application/octet-stream",
      "digest": "sha256:9e1fbc8415ecf99f413316e55c130780277278267ef7710bf2a6fa721ad9678b",
      "bytes": 6439
    },
    {
      "path": "input/evidence/chunks/a4e7cdeddc4ebda93c474c7fbb7dd4ed3aabd95250a05a484ffe43dc99ae2b1d.bin",
      "role": "submission-evidence-chunk",
      "mediaType": "application/octet-stream",
      "digest": "sha256:a4e7cdeddc4ebda93c474c7fbb7dd4ed3aabd95250a05a484ffe43dc99ae2b1d",
      "bytes": 6065
    },
    {
      "path": "input/evidence/chunks/bebd37a80c7d7aafcd0536eed61cfc98c83d89bacd4576463d137b3c02f4d648.bin",
      "role": "submission-evidence-chunk",
      "mediaType": "application/octet-stream",
      "digest": "sha256:bebd37a80c7d7aafcd0536eed61cfc98c83d89bacd4576463d137b3c02f4d648",
      "bytes": 873
    },
    {
      "path": "input/evidence/manifest.json",
      "role": "submission-evidence-manifest",
      "mediaType": "application/json",
      "digest": "sha256:4c550ca8a53b22b13ad355e6825075cead1dcde517990f4a45b02bbf18a4b917",
      "bytes": 2331
    },
    {
      "path": "input/root-contract.json",
      "role": "work-root-contract",
      "mediaType": "application/json",
      "digest": "sha256:66853b6b7992d661340dd8b4c6f1b30978eb187a06d1cd275ee8b27bb15cef85",
      "bytes": 1988
    },
    {
      "path": "input/target-knowledge-state.json",
      "role": "work-target-knowledge-state",
      "mediaType": "application/json",
      "digest": "sha256:c2f4c020c87250e8f663ebd87649dae54e1c446f89e1ba985e6453b031ddf358",
      "bytes": 70765
    },
    {
      "path": "input/topology-alignment.json",
      "role": "work-topology-alignment",
      "mediaType": "application/json",
      "digest": "sha256:04bdaf4a4303d2fff29b3497e08aa57b5735fa16004bc40cebc3ff1349276e2a",
      "bytes": 18381
    },
    {
      "path": "stages/no-access/input.json",
      "role": "no-access-stage-input",
      "mediaType": "application/json",
      "digest": "sha256:58c2cd0655ef4d50bcc5183dbf545c956787811e5777cbd83e2aa0da4b5b6aa1",
      "bytes": 36214
    },
    {
      "path": "stages/no-access/request.json",
      "role": "no-access-request",
      "mediaType": "application/json",
      "digest": "sha256:cab555a7a398a1dc47d16de767134ef3ab59ce1b2740597dafc55e816f39e1ed",
      "bytes": 52636
    },
    {
      "path": "stages/no-access/response.json",
      "role": "no-access-response",
      "mediaType": "application/json",
      "digest": "sha256:a943a88a9674def7534dd2168105ee667c6c30e57238ad439194f029025950d0",
      "bytes": 2455
    },
    {
      "path": "stages/safe-facts/request.json",
      "role": "safe-facts-request",
      "mediaType": "application/json",
      "digest": "sha256:6dfcacafd81dcfffb8cb0289ca594ab7b8fc6ea7fb12e0857ce4b01c40798bd7",
      "bytes": 16877
    },
    {
      "path": "stages/safe-facts/response.json",
      "role": "safe-facts-response",
      "mediaType": "application/json",
      "digest": "sha256:11d8b67e4e4eb12ddbf3e2ab56d81db524a1409f0a1b81316401521ac8cd3ca3",
      "bytes": 1237
    },
    {
      "path": "stages/with-access/input.json",
      "role": "with-access-stage-input",
      "mediaType": "application/json",
      "digest": "sha256:c054dc72dca81a0108e03cabfc4e5538bc3fbd0420eddade2254df0f3cd0bff0",
      "bytes": 37097
    },
    {
      "path": "stages/with-access/request.json",
      "role": "with-access-request",
      "mediaType": "application/json",
      "digest": "sha256:9bdb2e6210873c8a363c339155ff4324c9beb3bb9c79986aa9e7f46bda7d3384",
      "bytes": 53595
    },
    {
      "path": "stages/with-access/response.json",
      "role": "with-access-response",
      "mediaType": "application/json",
      "digest": "sha256:764abb6dcf872c684e47966deea5d442e2f5f4ac1681baabb2af4260d012d1f2",
      "bytes": 2298
    },
    {
      "path": "state/no-access-patch.json",
      "role": "no-access-work-patch",
      "mediaType": "application/json",
      "digest": "sha256:832c465ae84d1b245899b2db8d610c87ec11569ee58fcfe6ae66c6a486a78b74",
      "bytes": 3373
    },
    {
      "path": "state/no-access-state.json",
      "role": "no-access-work-state",
      "mediaType": "application/json",
      "digest": "sha256:3fd40d5155f7b07bc7f35eb23730faa6ce818bd9be76afb8b624976be9509e55",
      "bytes": 11734
    },
    {
      "path": "state/with-access-patch.json",
      "role": "with-access-work-patch",
      "mediaType": "application/json",
      "digest": "sha256:deebd069f9c68d744a93064d233b6342fb4a6fb7b1d6486fa8a9bf962bf867bf",
      "bytes": 3218
    },
    {
      "path": "state/with-access-state.json",
      "role": "with-access-work-state",
      "mediaType": "application/json",
      "digest": "sha256:de81caeb4bd588161b5670ff55a54dc13496e9813fcae9a82ae29b1efb878be3",
      "bytes": 11777
    }
  ]
}
